"","p_val","avg_logFC","pct.1","pct.2","p_val_adj","cluster","gene","GeneName","AlsoPresentInClusters","CellTypeFlag","Summary","Reactom","GeneFamily"
"574",1.40812101113995e-90,2.1737276398198,0.628,0.099,3.24938004530654e-86,"19","LTB","lymphotoxin beta","19, 9","lymphoid","Lymphotoxin beta is a type II membrane protein of the TNF family. It anchors lymphotoxin-alpha to the cell surface through heterotrimer formation. The predominant form on the lymphocyte surface is the lymphotoxin-alpha 1/beta 2 complex (e.g. 1 molecule alpha/2 molecules beta) and this complex is the primary ligand for the lymphotoxin-beta receptor. The minor complex is lymphotoxin-alpha 2/beta 1. LTB is an inducer of the inflammatory response system and involved in normal development of lymphoid tissue. Lymphotoxin-beta isoform b is unable to complex with lymphotoxin-alpha suggesting a function for lymphotoxin-beta which is independent of lympyhotoxin-alpha. Alternative splicing results in multiple transcript variants encoding different isoforms. [provided by RefSeq, Jul 2008]","TNFR2 non-canonical NF-kB pathway; TNF receptor superfamily (TNFSF) members mediating non-canonical NF-kB pathway; TNF receptor superfamily (TNFSF) members mediating non-canonical NF-kB pathway","Tumor necrosis factor superfamily"
"575",4.43325863431312e-88,1.25497348284784,0.549,0.072,1.0230187624541e-83,"19","AREG","amphiregulin","","astrocyte, fibroblasts, mammary gland cell milk secretion, oocyte, schwann cell","The protein encoded by this gene is a member of the epidermal growth factor family. It is an autocrine growth factor as well as a mitogen for astrocytes, Schwann cells and fibroblasts. It is related to epidermal growth factor (EGF) and transforming growth factor alpha (TGF-alpha). The protein interacts with the EGF/TGF-alpha receptor to promote the growth of normal epithelial cells, and it inhibits the growth of certain aggressive carcinoma cell lines. It also functions in mammary gland, oocyte and bone tissue development. This gene is associated with a psoriasis-like skin phenotype, and is also associated with other pathological disorders, including various types of cancers and inflammatory conditions. [provided by RefSeq, Apr 2014]","COPII-mediated vesicle transport; Cargo concentration in the ER","Endogenous ligands"
"576",1.28241822474369e-87,1.43394379261784,0.637,0.102,2.95930829541854e-83,"19","PLAC8","placenta specific 8","19, 9","neutrophil granulocyte","Not available","Neutrophil degranulation",""
"577",1.53890987662357e-84,1.59094621446834,0.947,0.291,3.55118843129655e-80,"19","CD44","CD44 molecule (Indian blood group)","15, 19","neutrophil granulocyte","The protein encoded by this gene is a cell-surface glycoprotein involved in cell-cell interactions, cell adhesion and migration. It is a receptor for hyaluronic acid (HA) and can also interact with other ligands, such as osteopontin, collagens, and matrix metalloproteinases (MMPs). This protein participates in a wide variety of cellular functions including lymphocyte activation, recirculation and homing, hematopoiesis, and tumor metastasis. Transcripts for this gene undergo complex alternative splicing that results in many functionally distinct isoforms, however, the full length nature of some of these variants has not been determined. Alternative splicing is the basis for the structural and functional diversity of this protein, and may be related to tumor metastasis. [provided by RefSeq, Jul 2008]","Degradation of the extracellular matrix; Cell surface interactions at the vascular wall; Integrin cell surface interactions; Hyaluronan uptake and degradation; Neutrophil degranulation; Interferon gamma signaling","Blood group antigens|CD molecules|Proteoglycans"
"578",1.28590637700017e-72,1.34430425613609,0.708,0.163,2.9673575555656e-68,"19","GPR65","G protein-coupled receptor 65","","","Not available","Class A/1 (Rhodopsin-like receptors); G alpha (q) signalling events","G protein-coupled receptors, Class A orphans"
"579",1.20796632393537e-61,1.23357322961925,0.381,0.049,2.78750308911327e-57,"19","IL7R","interleukin 7 receptor","","","The protein encoded by this gene is a receptor for interleukin 7 (IL7). The function of this receptor requires the interleukin 2 receptor, gamma chain (IL2RG), which is a common gamma chain shared by the receptors of various cytokines, including interleukins 2, 4, 7, 9, and 15. This protein has been shown to play a critical role in V(D)J recombination during lymphocyte development. Defects in this gene may be associated with severe combined immunodeficiency (SCID). Alternatively spliced transcript variants have been found. [provided by RefSeq, Dec 2015]","Interleukin-7 signaling; Interleukin-7 signaling; Cargo recognition for clathrin-mediated endocytosis; Clathrin-mediated endocytosis","CD molecules|Fibronectin type III domain containing|Interleukin receptors"
"580",2.15482052558628e-57,1.09646937231337,0.735,0.204,4.9724638448429e-53,"19","LSP1","lymphocyte specific protein 1","15, 19, 9","endothelial cells, macrophage, neutrophil granulocyte","This gene encodes an intracellular F-actin binding protein. The protein is expressed in lymphocytes, neutrophils, macrophages, and endothelium and may regulate neutrophil motility, adhesion to fibrinogen matrix proteins, and transendothelial migration. Alternative splicing results in multiple transcript variants encoding different isoforms. [provided by RefSeq, Jul 2008]","",""
"581",3.21979337268478e-57,1.08492516503243,0.602,0.138,7.42999518680739e-53,"19","ITM2A","integral membrane protein 2A","19, 9","","This gene encodes a type II membrane protein that belongs to the ITM2 family. Studies in mouse suggest that it may be involved in osteo- and chondrogenic differentiation. Alternatively spliced transcript variants encoding different isoforms have been found for this gene. [provided by RefSeq, Jan 2010]","","BRICHOS domain containing"
"582",3.8341116426065e-55,1.88586403355726,0.788,0.284,8.84759602647876e-51,"19","CD52","CD52 molecule","15, 19, 9","","Not available","Post-translational modification: synthesis of GPI-anchored proteins","CD molecules"
"583",1.95214425853199e-54,1.14246345278395,0.522,0.104,4.50476809098841e-50,"19","CD69","CD69 molecule","13, 19","megakaryocyte, natural killer cell","This gene encodes a member of the calcium dependent lectin superfamily of type II transmembrane receptors. Expression of the encoded protein is induced upon activation of T lymphocytes, and may play a role in proliferation. Furthermore, the protein may act to transmit signals in natural killer cells and platelets. [provided by RefSeq, Aug 2011]","","CD molecules|C-type lectin domain containing"
"584",3.66189215819462e-52,1.27385341553121,1,0.933,8.4501823442499e-48,"19","PABPC1","poly(A) binding protein cytoplasmic 1","","","This gene encodes a poly(A) binding protein. The protein shuttles between the nucleus and cytoplasm and binds to the 3' poly(A) tail of eukaryotic messenger RNAs via RNA-recognition motifs. The binding of this protein to poly(A) promotes ribosome recruitment and translation initiation; it is also required for poly(A) shortening which is the first step in mRNA decay. The gene is part of a small gene family including three protein-coding genes and several pseudogenes.[provided by RefSeq, Aug 2010]","L13a-mediated translational silencing of Ceruloplasmin expression; Deadenylation of mRNA; AUF1 (hnRNP D0) binds and destabilizes mRNA; Translation initiation complex formation; Regulation of expression of SLITs and ROBOs; Nonsense Mediated Decay (NMD) independent of the Exon Junction Complex (EJC); Nonsense Mediated Decay (NMD) enhanced by the Exon Junction Complex (EJC)","RNA binding motif containing"
"585",3.05200366654314e-50,2.96129327078733,0.628,0.183,7.04280366091495e-46,"19","NKG7","natural killer cell granule protein 7","","","Not available","",""
"586",5.65979806456644e-47,1.42134047764563,0.77,0.333,1.30605500137935e-42,"19","MAP3K8","mitogen-activated protein kinase kinase kinase 8","","","This gene is an oncogene that encodes a member of the serine/threonine protein kinase family. The encoded protein localizes to the cytoplasm and can activate both the MAP kinase and JNK kinase pathways. This protein was shown to activate IkappaB kinases, and thus induce the nuclear production of NF-kappaB. This protein was also found to promote the production of TNF-alpha and IL-2 during T lymphocyte activation. This gene may also utilize a downstream in-frame translation start codon, and thus produce an isoform containing a shorter N-terminus. The shorter isoform has been shown to display weaker transforming activity. Alternate splicing results in multiple transcript variants that encode the same protein. [provided by RefSeq, Sep 2011]","CD28 dependent PI3K/Akt signaling; MAP3K8 (TPL2)-dependent MAPK1/3 activation; MAP3K8 (TPL2)-dependent MAPK1/3 activation","Mitogen-activated protein kinase kinase kinases"
"587",4.56368892130288e-46,1.06961269697501,0.743,0.288,1.05311685547985e-41,"19","PTPRC","protein tyrosine phosphatase, receptor type C","","b cell, neutrophil granulocyte","The protein encoded by this gene is a member of the protein tyrosine phosphatase (PTP) family. PTPs are known to be signaling molecules that regulate a variety of cellular processes including cell growth, differentiation, mitosis, and oncogenic transformation. This PTP contains an extracellular domain, a single transmembrane segment and two tandem intracytoplasmic catalytic domains, and thus is classified as a receptor type PTP. This PTP has been shown to be an essential regulator of T- and B-cell antigen receptor signaling. It functions through either direct interaction with components of the antigen receptor complexes, or by activating various Src family kinases required for the antigen receptor signaling. This PTP also suppresses JAK kinases, and thus functions as a regulator of cytokine receptor signaling. Alternatively spliced transcripts variants of this gene, which encode distinct isoforms, have been reported. [provided by RefSeq, Jun 2012]","Phosphorylation of CD3 and TCR zeta chains; Other semaphorin interactions; Neutrophil degranulation","CD molecules|Fibronectin type III domain containing|Protein tyrosine phosphatases, receptor type"
"588",5.90471511422264e-46,1.12224182660873,1,0.74,1.36257205975802e-41,"19","SRGN","serglycin","1, 15, 19","megakaryocyte","This gene encodes a protein best known as a hematopoietic cell granule proteoglycan. Proteoglycans stored in the secretory granules of many hematopoietic cells also contain a protease-resistant peptide core, which may be important for neutralizing hydrolytic enzymes. This encoded protein was found to be associated with the macromolecular complex of granzymes and perforin, which may serve as a mediator of granule-mediated apoptosis. Two transcript variants, only one of them protein-coding, have been found for this gene. [provided by RefSeq, Jul 2010]","Platelet degranulation ","Proteoglycans"
"589",1.61017815908861e-45,1.09413437092834,1,0.874,3.71564711991288e-41,"19","RPL17","ribosomal protein L17","19, 6","","Ribosomes, the organelles that catalyze protein synthesis, consist of a small 40S subunit and a large 60S subunit. Together these subunits are composed of 4 RNA species and approximately 80 structurally distinct proteins. This gene encodes a ribosomal protein that is a component of the 60S subunit. The protein belongs to the L22P family of ribosomal proteins. It is located in the cytoplasm. This gene has been referred to as rpL23 because the encoded protein shares amino acid identity with ribosomal protein L23 from Halobacterium marismortui; however, its official symbol is RPL17. As is typical for genes encoding ribosomal proteins, there are multiple processed pseudogenes of this gene dispersed through the genome. Alternative splicing results in multiple transcript variants. Read-through transcription also exists between this gene and the neighboring downstream C18orf32 (chromosome 18 open reading frame 32) gene. [provided by RefSeq, Dec 2010]","L13a-mediated translational silencing of Ceruloplasmin expression; Peptide chain elongation; SRP-dependent cotranslational protein targeting to membrane; SRP-dependent cotranslational protein targeting to membrane; Viral mRNA Translation; Selenocysteine synthesis; Major pathway of rRNA processing in the nucleolus and cytosol; Formation of a pool of free 40S subunits; GTP hydrolysis and joining of the 60S ribosomal subunit; Eukaryotic Translation Termination; Regulation of expression of SLITs and ROBOs; Nonsense Mediated Decay (NMD) independent of the Exon Junction Complex (EJC); Nonsense Mediated Decay (NMD) enhanced by the Exon Junction Complex (EJC)","L ribosomal proteins"
"590",3.71035875295411e-41,1.07234105201649,0.965,0.833,8.5620238583169e-37,"19","NBEAL1","neurobeachin like 1","","","Not available","","WD repeat domain containing|BEACH domain containing |Armadillo-like helical domain containing"
"591",1.81721954935736e-38,1.21182385265802,0.566,0.175,4.19341583209704e-34,"19","STK17A","serine/threonine kinase 17a","14, 19","","This gene is a member of the DAP kinase-related apoptosis-inducing protein kinase family and encodes an autophosphorylated nuclear protein with a protein kinase domain. The protein has apoptosis-inducing activity. [provided by RefSeq, Jul 2008]","","Death associated protein kinases"
"592",1.97569329692868e-38,1.21123580537169,0.903,0.615,4.55910985199262e-34,"19","BTG1","BTG anti-proliferation factor 1","","b cell","This gene is a member of an anti-proliferative gene family that regulates cell growth and differentiation. Expression of this gene is highest in the G0/G1 phases of the cell cycle and downregulated when cells progressed through G1. The encoded protein interacts with several nuclear receptors, and functions as a coactivator of cell differentiation. This locus has been shown to be involved in a t(8;12)(q24;q22) chromosomal translocation in a case of B-cell chronic lymphocytic leukemia. [provided by RefSeq, Oct 2008]","","BTG/Tob family"
"593",1.49846440626324e-36,1.4132075786447,0.575,0.179,3.45785646389305e-32,"19","RGS1","regulator of G protein signaling 1","","","This gene encodes a member of the regulator of G-protein signalling family. This protein is located on the cytosolic side of the plasma membrane and contains a conserved, 120 amino acid motif called the RGS domain. The protein attenuates the signalling activity of G-proteins by binding to activated, GTP-bound G alpha subunits and acting as a GTPase activating protein (GAP), increasing the rate of conversion of the GTP to GDP. This hydrolysis allows the G alpha subunits to bind G beta/gamma subunit heterodimers, forming inactive G-protein heterotrimers, thereby terminating the signal. [provided by RefSeq, Jul 2008]","G alpha (i) signalling events","Regulators of G-protein signaling"
"594",2.18011670074328e-34,1.05295230432292,0.779,0.402,5.03083729863518e-30,"19","LIMD2","LIM domain containing 2","","","Not available","","LIM domain containing"
"595",2.97219358609735e-33,2.57885119669678,0.646,0.29,6.85863391927824e-29,"19","CMC1","C-X9-C motif containing 1","","","Not available","",""
"596",6.57588268674051e-33,1.45222366211118,0.381,0.084,1.51745068879224e-28,"19","IL32","interleukin 32","","macrophage","This gene encodes a member of the cytokine family. The protein contains a tyrosine sulfation site, 3 potential N-myristoylation sites, multiple putative phosphorylation sites, and an RGD cell-attachment sequence. Expression of this protein is increased after the activation of T-cells by mitogens or the activation of NK cells by IL-2. This protein induces the production of TNFalpha from macrophage cells. Alternate transcriptional splice variants, encoding different isoforms, have been characterized. [provided by RefSeq, Jul 2008]","Other interleukin signaling","Interleukins"
"597",1.99380387510312e-29,1.35200924906244,0.805,0.537,4.60090182218796e-25,"19","CREM","cAMP responsive element modulator","","","This gene encodes a bZIP transcription factor that binds to the cAMP responsive element found in many viral and cellular promoters. It is an important component of cAMP-mediated signal transduction during the spermatogenetic cycle, as well as other complex processes. Alternative promoter and translation initiation site usage allows this gene to exert spatial and temporal specificity to cAMP responsiveness. Multiple alternatively spliced transcript variants encoding several different isoforms have been found for this gene, with some of them functioning as activators and some as repressors of transcription. [provided by RefSeq, Jul 2008]","Circadian Clock","Basic leucine zipper proteins"
"598",2.17046620644436e-17,1.27353887623654,0.735,0.59,5.008567817991e-13,"19","PPP1CB","protein phosphatase 1 catalytic subunit beta","","","The protein encoded by this gene is one of the three catalytic subunits of protein phosphatase 1 (PP1). PP1 is a serine/threonine specific protein phosphatase known to be involved in the regulation of a variety of cellular processes, such as cell division, glycogen metabolism, muscle contractility, protein synthesis, and HIV-1 viral transcription. Mouse studies suggest that PP1 functions as a suppressor of learning and memory. Two alternatively spliced transcript variants encoding distinct isoforms have been observed. [provided by RefSeq, Jul 2008]","Triglyceride catabolism; Downregulation of TGF-beta receptor signaling; Regulation of PLK1 Activity at G2/M Transition; Circadian Clock; RHO GTPases activate PKNs; RHO GTPases activate PKNs; RHO GTPases activate CIT; RHO GTPases Activate ROCKs; RHO GTPases activate PAKs; RHO GTPases activate PAKs","Protein phosphatase catalytic subunits"
"599",7.28145467992537e-17,1.08737567244038,0.823,0.737,1.68026848193958e-12,"19","IFITM2","interferon induced transmembrane protein 2","","","Not available","Interferon alpha/beta signaling","Interferon induced transmembrane proteins"
"600",2.22723958699337e-16,1.73726443347966,0.381,0.145,5.13957807094589e-12,"19","CCL5","C-C motif chemokine ligand 5","13, 19","basophil granulocyte, eosinophil granulocyte, monocyte","This gene is one of several chemokine genes clustered on the q-arm of chromosome 17. Chemokines form a superfamily of secreted proteins involved in immunoregulatory and inflammatory processes. The superfamily is divided into four subfamilies based on the arrangement of the N-terminal cysteine residues of the mature peptide. This chemokine, a member of the CC subfamily, functions as a chemoattractant for blood monocytes, memory T helper cells and eosinophils. It causes the release of histamine from basophils and activates eosinophils. This cytokine is one of the major HIV-suppressive factors produced by CD8+ cells. It functions as one of the natural ligands for the chemokine receptor chemokine (C-C motif) receptor 5 (CCR5), and it suppresses in vitro replication of the R5 strains of HIV-1, which use CCR5 as a coreceptor. Alternative splicing results in multiple transcript variants that encode different isoforms. [provided by RefSeq, Jul 2013]","Chemokine receptors bind chemokines; G alpha (i) signalling events; Interleukin-10 signaling","Chemokine ligands|Endogenous ligands"
"601",0,1.31432632621517,0.993,0.68,0,"2","C1QA","complement C1q A chain","10, 12, 2","","This gene encodes the A-chain polypeptide of serum complement subcomponent C1q, which associates with C1r and C1s to yield the first component of the serum complement system. C1q deficiency is associated with lupus erythematosus and glomerulonephritis. C1q is composed of 18 polypeptide chains which include 6 A-chains, 6 B-chains, and 6 C-chains. Each chain contains an N-terminal collagen-like region and a C-terminal C1q globular domain. Alternate splicing results in multiple transcript variants. [provided by RefSeq, Nov 2016]","Initial triggering of complement; Classical antibody-mediated complement activation; Regulation of Complement cascade","Complement system activation components|C1q domain containing"
"602",0,1.26856378265892,0.993,0.614,0,"2","C1QB","complement C1q B chain","10, 12, 2","","This gene encodes the B-chain polypeptide of serum complement subcomponent C1q, which associates with C1r and C1s to yield the first component of the serum complement system. C1q is composed of 18 polypeptide chains which include 6 A-chains, 6 B-chains, and 6 C-chains. Each chain contains an N-terminal collagen-like region and a C-terminal C1q globular domain. C1q deficiency is associated with lupus erythematosus and glomerulonephritis. [provided by RefSeq, Dec 2016]","Initial triggering of complement; Classical antibody-mediated complement activation; Regulation of Complement cascade","Complement system activation components|C1q domain containing"
"603",0,1.238598371676,0.999,0.646,0,"2","C1QC","complement C1q C chain","10, 12, 2","","This gene encodes the C-chain polypeptide of serum complement subcomponent C1q, which associates with C1r and C1s to yield the first component of the serum complement system. C1q is composed of 18 polypeptide chains which include 6 A-chains, 6 B-chains, and 6 C-chains. Each chain contains an N-terminal collagen-like region and a C-terminal C1q globular domain. C1q deficiency is associated with lupus erythematosus and glomerulonephritis. [provided by RefSeq, Dec 2016]","Initial triggering of complement; Classical antibody-mediated complement activation; Regulation of Complement cascade","Complement system activation components|C1q domain containing"
"604",0,1.17389613185004,0.974,0.61,0,"2","AGR2","anterior gradient 2, protein disulphide isomerase family member","10, 12, 2","","This gene encodes a member of the disulfide isomerase (PDI) family of endoplasmic reticulum (ER) proteins that catalyze protein folding and thiol-disulfide interchange reactions. The encoded protein has an N-terminal ER-signal sequence, a catalytically active thioredoxin domain, and a C-terminal ER-retention sequence. This protein plays a role in cell migration, cellular transformation and metastasis and is as a p53 inhibitor. As an ER-localized molecular chaperone, it plays a role in the folding, trafficking, and assembly of cysteine-rich transmembrane receptors and the cysteine-rich intestinal gylcoprotein mucin. This gene has been implicated in inflammatory bowel disease and cancer progression. [provided by RefSeq, Mar 2017]","","Protein disulfide isomerases"
"605",0,1.07652315322962,0.999,0.79,0,"2","AIF1","allograft inflammatory factor 1","10, 12, 2","macrophage, smooth muscle cell","This gene encodes a protein that binds actin and calcium. This gene is induced by cytokines and interferon and may promote macrophage activation and growth of vascular smooth muscle cells and T-lymphocytes. Polymorphisms in this gene may be associated with systemic sclerosis. Alternative splicing results in multiple transcript variants, but the full-length and coding nature of some of these variants is not certain. [provided by RefSeq, Jan 2016]","","EF-hand domain containing"
"606",0,1.01599920915848,0.995,0.779,0,"2","HSPA1A","heat shock protein family A (Hsp70) member 1A","10, 2, 7","neutrophil granulocyte","This intronless gene encodes a 70kDa heat shock protein which is a member of the heat shock protein 70 family. In conjuction with other heat shock proteins, this protein stabilizes existing proteins against aggregation and mediates the folding of newly translated proteins in the cytosol and in organelles. It is also involved in the ubiquitin-proteasome pathway through interaction with the AU-rich element RNA-binding protein 1. The gene is located in the major histocompatibility complex class III region, in a cluster with two closely related genes which encode similar proteins. [provided by RefSeq, Jul 2008]","Viral RNP Complexes in the Host Cell Nucleus; Regulation of HSF1-mediated heat shock response; HSP90 chaperone cycle for steroid hormone receptors (SHR); HSF1 activation; Attenuation phase; HSF1-dependent transactivation; AUF1 (hnRNP D0) binds and destabilizes mRNA; Neutrophil degranulation","Heat shock 70kDa proteins|TIM23 complex"
"607",0,1.00824064870296,0.875,0.358,0,"2","NR4A2","nuclear receptor subfamily 4 group A member 2","10, 2","","This gene encodes a member of the steroid-thyroid hormone-retinoid receptor superfamily. The encoded protein may act as a transcription factor. Mutations in this gene have been associated with disorders related to dopaminergic dysfunction, including Parkinson disease, schizophernia, and manic depression. Misregulation of this gene may be associated with rheumatoid arthritis. Alternatively spliced transcript variants have been described, but their biological validity has not been determined. [provided by RefSeq, Jul 2008]","Nuclear Receptor transcription pathway; SUMOylation of intracellular receptors","Nuclear hormone receptors"
"608",0,0.996530385453072,0.834,0.415,0,"2","RGS2","regulator of G protein signaling 2","10, 2","myeloid","Regulator of G protein signaling (RGS) family members are regulatory molecules that act as GTPase activating proteins (GAPs) for G alpha subunits of heterotrimeric G proteins. RGS proteins are able to deactivate G protein subunits of the Gi alpha, Go alpha and Gq alpha subtypes. They drive G proteins into their inactive GDP-bound forms. Regulator of G protein signaling 2 belongs to this family. The protein acts as a mediator of myeloid differentiation and may play a role in leukemogenesis. [provided by RefSeq, Aug 2009]","G alpha (q) signalling events","Endogenous ligands|Regulators of G-protein signaling"
