"","p_val","avg_logFC","pct.1","pct.2","p_val_adj","cluster","gene","GeneName","AlsoPresentInClusters","CellTypeFlag","Summary","Reactom","GeneFamily"
"1",0,1.25175146643159,1,0.871,0,"0","SPP1","secreted phosphoprotein 1","0, 1","osteoclast","The protein encoded by this gene is involved in the attachment of osteoclasts to the mineralized bone matrix. The encoded protein is secreted and binds hydroxyapatite with high affinity. The osteoclast vitronectin receptor is found in the cell membrane and may be involved in the binding to this protein. This protein is also a cytokine that upregulates expression of interferon-gamma and interleukin-12. Several transcript variants encoding different isoforms have been found for this gene. [provided by RefSeq, Oct 2011]","Degradation of the extracellular matrix; Signaling by PDGF; Integrin cell surface interactions; Integrin cell surface interactions; Regulation of Insulin-like Growth Factor (IGF) transport and uptake by Insulin-like Growth Factor Binding Proteins (IGFBPs); RUNX3 Regulates Immune Response and Cell Migration; Post-translational protein phosphorylation","Endogenous ligands|SIBLING family"
"2",0,1.16100103581823,1,1,0,"0","FTL","ferritin light chain","0, 1, 7","neutrophil granulocyte","This gene encodes the light subunit of the ferritin protein. Ferritin is the major intracellular iron storage protein in prokaryotes and eukaryotes. It is composed of 24 subunits of the heavy and light ferritin chains. Variation in ferritin subunit composition may affect the rates of iron uptake and release in different tissues. A major function of ferritin is the storage of iron in a soluble and nontoxic state. Defects in this light chain ferritin gene are associated with several neurodegenerative diseases and hyperferritinemia-cataract syndrome. This gene has multiple pseudogenes. [provided by RefSeq, Jul 2008]","Scavenging by Class A Receptors; Golgi Associated Vesicle Biogenesis; Neutrophil degranulation; Iron uptake and transport","Ferritin subunits"
"3",0,1.08131277427575,0.978,0.63,0,"0","LGMN","legumain","0, 1","dendritic cell, monocyte","This gene encodes a cysteine protease that has a strict specificity for hydrolysis of asparaginyl bonds. This enzyme may be involved in the processing of bacterial peptides and endogenous proteins for MHC class II presentation in the lysosomal/endosomal systems. Enzyme activation is triggered by acidic pH and appears to be autocatalytic. Protein expression occurs after monocytes differentiate into dendritic cells. A fully mature, active enzyme is produced following lipopolysaccharide expression in mature dendritic cells. Overexpression of this gene may be associated with the majority of solid tumor types. This gene has a pseudogene on chromosome 13. Several alternatively spliced transcript variants have been described, but the biological validity of only two has been determined. These two variants encode the same isoform. [provided by RefSeq, Jul 2008]","Trafficking and processing of endosomal TLR; Vitamin D (calciferol) metabolism; MHC class II antigen presentation",""
"4",0,1.07751486937624,0.997,0.8,0,"0","CTSB","cathepsin B","0, 1, 7","neutrophil granulocyte, progenitor","This gene encodes a member of the C1 family of peptidases. Alternative splicing of this gene results in multiple transcript variants. At least one of these variants encodes a preproprotein that is proteolytically processed to generate multiple protein products. These products include the cathepsin B light and heavy chains, which can dimerize to form the double chain form of the enzyme. This enzyme is a lysosomal cysteine protease with both endopeptidase and exopeptidase activity that may play a role in protein turnover. It is also known as amyloid precursor protein secretase and is involved in the proteolytic processing of amyloid precursor protein (APP). Incomplete proteolytic processing of APP has been suggested to be a causative factor in Alzheimer's disease, the most common cause of dementia. Overexpression of the encoded protein has been associated with esophageal adenocarcinoma and other tumors. Multiple pseudogenes of this gene have been identified. [provided by RefSeq, Nov 2015]","Collagen degradation; Trafficking and processing of endosomal TLR; Assembly of collagen fibrils and other multimeric structures; MHC class II antigen presentation; Neutrophil degranulation","Cathepsins"
"5",0,1.06496268262978,0.912,0.431,0,"0","F13A1","coagulation factor XIII A chain","0, 1","gastric gland zymogenic cell, megakaryocyte","This gene encodes the coagulation factor XIII A subunit. Coagulation factor XIII is the last zymogen to become activated in the blood coagulation cascade. Plasma factor XIII is a heterotetramer composed of 2 A subunits and 2 B subunits. The A subunits have catalytic function, and the B subunits do not have enzymatic activity and may serve as plasma carrier molecules. Platelet factor XIII is comprised only of 2 A subunits, which are identical to those of plasma origin. Upon cleavage of the activation peptide by thrombin and in the presence of calcium ion, the plasma factor XIII dissociates its B subunits and yields the same active enzyme, factor XIIIa, as platelet factor XIII. This enzyme acts as a transglutaminase to catalyze the formation of gamma-glutamyl-epsilon-lysine crosslinking between fibrin molecules, thus stabilizing the fibrin clot. It also crosslinks alpha-2-plasmin inhibitor, or fibronectin, to the alpha chains of fibrin. Factor XIII deficiency is classified into two categories: type I deficiency, characterized by the lack of both the A and B subunits; and type II deficiency, characterized by the lack of the A subunit alone. These defects can result in a lifelong bleeding tendency, defective wound healing, and habitual abortion. [provided by RefSeq, Jul 2008]","Platelet degranulation ; Common Pathway of Fibrin Clot Formation; Interleukin-4 and Interleukin-13 signaling","Transglutaminases"
"6",0,1.05053314982425,0.995,0.788,0,"0","CTSD","cathepsin D","0, 7","neutrophil granulocyte","This gene encodes a member of the A1 family of peptidases. The encoded preproprotein is proteolytically processed to generate multiple protein products. These products include the cathepsin D light and heavy chains, which heterodimerize to form the mature enzyme. This enzyme exhibits pepsin-like activity and plays a role in protein turnover and in the proteolytic activation of hormones and growth factors. Mutations in this gene play a causal role in neuronal ceroid lipofuscinosis-10 and may be involved in the pathogenesis of several other diseases, including breast cancer and possibly Alzheimer's disease. [provided by RefSeq, Nov 2015]","Collagen degradation; Metabolism of Angiotensinogen to Angiotensins; MHC class II antigen presentation; Neutrophil degranulation; Estrogen-dependent gene expression","Cathepsins"
"7",0,1.04332497309478,0.993,0.693,0,"0","DAB2","DAB2, clathrin adaptor protein","0, 12, 7","","This gene encodes a mitogen-responsive phosphoprotein. It is expressed in normal ovarian epithelial cells, but is down-regulated or absent from ovarian carcinoma cell lines, suggesting its role as a tumor suppressor. This protein binds to the SH3 domains of GRB2, an adaptor protein that couples tyrosine kinase receptors to SOS (a guanine nucleotide exchange factor for Ras), via its C-terminal proline-rich sequences, and may thus modulate growth factor/Ras pathways by competing with SOS for binding to GRB2. Alternatively spliced transcript variants encoding different isoforms have been found for this gene. [provided by RefSeq, Oct 2011]","Gap junction degradation; Formation of annular gap junctions; Cargo recognition for clathrin-mediated endocytosis; Clathrin-mediated endocytosis",""
"8",0,1.03718767817833,1,0.779,0,"0","TYROBP","TYRO protein tyrosine kinase binding protein","0, 1, 7","lymphoid, myeloid, neutrophil granulocyte","This gene encodes a transmembrane signaling polypeptide which contains an immunoreceptor tyrosine-based activation motif (ITAM) in its cytoplasmic domain. The encoded protein may associate with the killer-cell inhibitory receptor (KIR) family of membrane glycoproteins and may act as an activating signal transduction element. This protein may bind zeta-chain (TCR) associated protein kinase 70kDa (ZAP-70) and spleen tyrosine kinase (SYK) and play a role in signal transduction, bone modeling, brain myelination, and inflammation. Mutations within this gene have been associated with polycystic lipomembranous osteodysplasia with sclerosing leukoencephalopathy (PLOSL), also known as Nasu-Hakola disease. Its putative receptor, triggering receptor expressed on myeloid cells 2 (TREM2), also causes PLOSL. Multiple alternative transcript variants encoding distinct isoforms have been identified for this gene. [provided by RefSeq, Mar 2010]","Immunoregulatory interactions between a Lymphoid and a non-Lymphoid cell; DAP12 interactions; DAP12 interactions; DAP12 signaling; DAP12 signaling; Signal regulatory protein family interactions; Other semaphorin interactions; Neutrophil degranulation",""
"9",0,0.995086529136445,0.899,0.391,0,"0","TREM2","triggering receptor expressed on myeloid cells 2","0, 7","lymphoid","This gene encodes a membrane protein that forms a receptor signaling complex with the TYRO protein tyrosine kinase binding protein. The encoded protein functions in immune response and may be involved in chronic inflammation by triggering the production of constitutive inflammatory cytokines. Defects in this gene are a cause of polycystic lipomembranous osteodysplasia with sclerosing leukoencephalopathy (PLOSL). Alternative splicing results in multiple transcript variants encoding different isoforms. [provided by RefSeq, Nov 2012]","Immunoregulatory interactions between a Lymphoid and a non-Lymphoid cell; DAP12 interactions; DAP12 signaling; DAP12 signaling; Other semaphorin interactions","V-set domain containing"
"10",0,0.983877524108256,0.849,0.337,0,"0","TMIGD3","transmembrane and immunoglobulin domain containing 3","0, 1, 7","","This gene encodes a transmembrane and immunoglobulin domain-containing protein. Alternative splicing results in multiple transcript variants, one of which shares its 5' terminal exon with that of the overlapping adenosine A3 receptor gene (GeneID:140), thus resulting in a fusion product. [provided by RefSeq, Nov 2014]","",""
"11",0,0.968722364966093,0.985,0.687,0,"0","CD14","CD14 molecule","0, 1, 7","macrophage, monocyte, neutrophil granulocyte","The protein encoded by this gene is a surface antigen that is preferentially expressed on monocytes/macrophages. It cooperates with other proteins to mediate the innate immune response to bacterial lipopolysaccharide. Alternative splicing results in multiple transcript variants encoding the same protein. [provided by RefSeq, Mar 2010]","ER-Phagosome pathway; via Death Receptors in the presence of ligand; Toll Like Receptor 4 (TLR4) Cascade; Transfer of LPS from LBP carrier to CD14; MyD88:Mal cascade initiated on plasma membrane; MyD88-independent TLR4 cascade ; Toll Like Receptor TLR1:TLR2 Cascade; Toll Like Receptor TLR6:TLR2 Cascade; TRIF-mediated programmed cell death; MyD88 deficiency (TLR2/4); IRAK4 deficiency (TLR2/4); Regulation of TLR by endogenous ligand; Neutrophil degranulation; TICAM1,TRAF6-dependent induction of TAK1 complex; Activation of IRF3/IRF7 mediated by TBK1/IKK epsilon; IKK complex recruitment mediated by RIP1; TRAF6-mediated induction of TAK1 complex within TLR4 complex; IRAK2 mediated activation of TAK1 complex upon TLR7/8 or 9 stimulation","CD molecules|Scavenger receptors"
"12",0,0.933215978312617,0.997,0.771,0,"0","RNASE1","ribonuclease A family member 1, pancreatic","0, 1, 10, 2","","This gene encodes a member of the pancreatic-type of secretory ribonucleases, a subset of the ribonuclease A superfamily. The encoded endonuclease cleaves internal phosphodiester RNA bonds on the 3'-side of pyrimidine bases. It prefers poly(C) as a substrate and hydrolyzes 2',3'-cyclic nucleotides, with a pH optimum near 8.0. The encoded protein is monomeric and more commonly acts to degrade ds-RNA over ss-RNA. Alternative splicing occurs at this locus and four transcript variants encoding the same protein have been identified. [provided by RefSeq, Jul 2008]","","Ribonuclease A family"
"13",0,0.873862787310887,0.978,0.599,0,"0","LYVE1","lymphatic vessel endothelial hyaluronan receptor 1","0, 1, 7","","This gene encodes a type I integral membrane glycoprotein. The encoded protein acts as a receptor and binds to both soluble and immobilized hyaluronan. This protein may function in lymphatic hyaluronan transport and have a role in tumor metastasis. [provided by RefSeq, Jul 2008]","Hyaluronan uptake and degradation",""
"14",0,0.864674651207975,0.986,0.717,0,"0","S100A9","S100 calcium binding protein A9","0, 1, 15, 7","neutrophil granulocyte","The protein encoded by this gene is a member of the S100 family of proteins containing 2 EF-hand calcium-binding motifs. S100 proteins are localized in the cytoplasm and/or nucleus of a wide range of cells, and involved in the regulation of a number of cellular processes such as cell cycle progression and differentiation. S100 genes include at least 13 members which are located as a cluster on chromosome 1q21. This protein may function in the inhibition of casein kinase and altered expression of this protein is associated with the disease cystic fibrosis. This antimicrobial protein exhibits antifungal and antibacterial activity. [provided by RefSeq, Nov 2014]","Regulation of TLR by endogenous ligand; Neutrophil degranulation; Metal sequestration by antimicrobial proteins","S100 calcium binding proteins|EF-hand domain containing"
"15",0,0.848361027400471,0.923,0.591,0,"0","CTSZ","cathepsin Z","","neutrophil granulocyte","The protein encoded by this gene is a lysosomal cysteine proteinase and member of the peptidase C1 family. It exhibits both carboxy-monopeptidase and carboxy-dipeptidase activities. The encoded protein has also been known as cathepsin X and cathepsin P. This gene is expressed ubiquitously in cancer cell lines and primary tumors and, like other members of this family, may be involved in tumorigenesis. [provided by RefSeq, Oct 2008]","Metabolism of Angiotensinogen to Angiotensins; COPII-mediated vesicle transport; Lysosome Vesicle Biogenesis; Cargo concentration in the ER; Neutrophil degranulation","Cathepsins"
"16",0,0.830693083315179,0.893,0.511,0,"0","STAB1","stabilin 1","0, 1, 7","endothelial cells","This gene encodes a large, transmembrane receptor protein which may function in angiogenesis, lymphocyte homing, cell adhesion, or receptor scavenging. The protein contains 7 fasciclin, 16 epidermal growth factor (EGF)-like, and 2 laminin-type EGF-like domains as well as a C-type lectin-like hyaluronan-binding Link module. The protein is primarily expressed on sinusoidal endothelial cells of liver, spleen, and lymph node. The receptor has been shown to endocytose ligands such as low density lipoprotein, Gram-positive and Gram-negative bacteria, and advanced glycosylation end products. Supporting its possible role as a scavenger receptor, the protein rapidly cycles between the plasma membrane and early endosomes. [provided by RefSeq, Jul 2008]","Scavenging by Class H Receptors","Scavenger receptors"
"17",0,0.826566168836179,0.999,0.855,0,"0","CSTB","cystatin B","","neutrophil granulocyte","The cystatin superfamily encompasses proteins that contain multiple cystatin-like sequences. Some of the members are active cysteine protease inhibitors, while others have lost or perhaps never acquired this inhibitory activity. There are three inhibitory families in the superfamily, including the type 1 cystatins (stefins), type 2 cystatins and kininogens. This gene encodes a stefin that functions as an intracellular thiol protease inhibitor. The protein is able to form a dimer stabilized by noncovalent forces, inhibiting papain and cathepsins l, h and b. The protein is thought to play a role in protecting against the proteases leaking from lysosomes. Evidence indicates that mutations in this gene are responsible for the primary defects in patients with progressive myoclonic epilepsy (EPM1). One type of mutation responsible for EPM1 is the expansion in the promoter region of this gene of a CCCCGCCCCGCG repeat from 2-3 copies to 30-78 copies. [provided by RefSeq, Jul 2016]","Neutrophil degranulation","Cystatins, type 1"
"18",0,0.819540776994829,0.966,0.649,0,"0","EGFL7","EGF like domain multiple 7","0, 1, 7","endothelial cells","This gene encodes a secreted endothelial cell protein that contains two epidermal growth factor-like domains. The encoded protein may play a role in regulating vasculogenesis. This protein may be involved in the growth and proliferation of tumor cells. Alternate splicing results in multiple transcript variants. [provided by RefSeq, Feb 2012]","",""
"19",0,0.816501692808806,0.997,0.856,0,"0","LGALS1","galectin 1","0, 1, 7","","The galectins are a family of beta-galactoside-binding proteins implicated in modulating cell-cell and cell-matrix interactions. This gene product may act as an autocrine negative growth factor that regulates cell proliferation. [provided by RefSeq, Jul 2008]","Regulation of Insulin-like Growth Factor (IGF) transport and uptake by Insulin-like Growth Factor Binding Proteins (IGFBPs); Post-translational protein phosphorylation","Endogenous ligands|Galectins"
"20",0,0.813924110427052,0.989,0.741,0,"0","FCER1G","Fc fragment of IgE receptor Ig","0, 1, 7","megakaryocyte, neutrophil granulocyte","The high affinity IgE receptor is a key molecule involved in allergic reactions. It is a tetramer composed of 1 alpha, 1 beta, and 2 gamma chains. The gamma chains are also subunits of other Fc receptors. [provided by RefSeq, Jul 2008]","GPVI-mediated activation cascade; Cell surface interactions at the vascular wall; Fc epsilon receptor (FCERI) signaling; Fc epsilon receptor (FCERI) signaling; Role of LAT2/NTAL/LAB on calcium mobilization; Role of LAT2/NTAL/LAB on calcium mobilization; FCERI mediated MAPK activation; FCERI mediated Ca+2 mobilization; FCERI mediated Ca+2 mobilization; FCERI mediated NF-kB activation; Dectin-2 family; Dectin-2 family; Neutrophil degranulation; Platelet Adhesion to exposed collagen",""
"21",0,0.780980078071043,0.777,0.446,0,"0","CHCHD10","coiled-coil-helix-coiled-coil-helix domain containing 10","0, 12, 7","","This gene encodes a mitochondrial protein that is enriched at cristae junctions in the intermembrane space. It may play a role in cristae morphology maintenance or oxidative phosphorylation. Mutations in this gene cause frontotemporal dementia and/or amyotrophic lateral sclerosis-2. Alternative splicing of this gene results in multiple transcript variants. Related pseudogenes have been identified on chromosomes 7 and 19. [provided by RefSeq, Aug 2014]","Mitochondrial protein import","Mitochondrial coiled-coil-helix-coiled-coil-helix domain containing proteins"
"22",0,0.777331845808842,0.998,0.884,0,"0","SH3BGRL3","SH3 domain binding glutamate rich protein like 3","0, 7","","Not available","",""
"23",0,0.776804924795757,0.949,0.646,0,"0","HCST","hematopoietic cell signal transducer","0, 1, 7","lymphoid","This gene encodes a transmembrane signaling adaptor that contains a YxxM motif in its cytoplasmic domain. The encoded protein may form part of the immune recognition receptor complex with the C-type lectin-like receptor NKG2D. As part of this receptor complex, this protein may activate phosphatidylinositol 3-kinase dependent signaling pathways through its intracytoplasmic YxxM motif. This receptor complex may have a role in cell survival and proliferation by activation of NK and T cell responses. Alternative splicing results in two transcript variants encoding different isoforms. [provided by RefSeq, Jul 2008]","Immunoregulatory interactions between a Lymphoid and a non-Lymphoid cell",""
"24",0,0.750378423849369,0.953,0.549,0,"0","CD68","CD68 molecule","0, 12, 2","connective tissue macrophage, macrophage, monocyte, neutrophil granulocyte","This gene encodes a 110-kD transmembrane glycoprotein that is highly expressed by human monocytes and tissue macrophages. It is a member of the lysosomal/endosomal-associated membrane glycoprotein (LAMP) family. The protein primarily localizes to lysosomes and endosomes with a smaller fraction circulating to the cell surface. It is a type I integral membrane protein with a heavily glycosylated extracellular domain and binds to tissue- and organ-specific lectins or selectins. The protein is also a member of the scavenger receptor family. Scavenger receptors typically function to clear cellular debris, promote phagocytosis, and mediate the recruitment and activation of macrophages. Alternative splicing results in multiple transcripts encoding different isoforms. [provided by RefSeq, Jul 2008]","Neutrophil degranulation","CD molecules|Scavenger receptors"
"25",0,0.740945167681545,1,0.922,0,"0","TMSB4X","thymosin beta 4 X-linked","0, 7","megakaryocyte","This gene encodes an actin sequestering protein which plays a role in regulation of actin polymerization. The protein is also involved in cell proliferation, migration, and differentiation. This gene escapes X inactivation and has a homolog on chromosome Y. [provided by RefSeq, Jul 2008]","Platelet degranulation ",""
"26",0,0.739181474912925,0.902,0.609,0,"0","ATP1B1","ATPase Na+/K+ transporting subunit beta 1","","","The protein encoded by this gene belongs to the family of Na+/K+ and H+/K+ ATPases beta chain proteins, and to the subfamily of Na+/K+ -ATPases. Na+/K+ -ATPase is an integral membrane protein responsible for establishing and maintaining the electrochemical gradients of Na and K ions across the plasma membrane. These gradients are essential for osmoregulation, for sodium-coupled transport of a variety of organic and inorganic molecules, and for electrical excitability of nerve and muscle. This enzyme is composed of two subunits, a large catalytic subunit (alpha) and a smaller glycoprotein subunit (beta). The beta subunit regulates, through assembly of alpha/beta heterodimers, the number of sodium pumps transported to the plasma membrane. The glycoprotein subunit of Na+/K+ -ATPase is encoded by multiple genes. This gene encodes a beta 1 subunit. Alternatively spliced transcript variants encoding different isoforms have been described, but their biological validity is not known. [provided by RefSeq, Mar 2010]","Basigin interactions; Ion homeostasis; Ion transport by P-type ATPases","ATPase Na+/K+ transporting subunits"
"27",0,0.732646880189984,0.847,0.407,0,"0","CD163","CD163 molecule","0, 1","macrophage, monocyte","The protein encoded by this gene is a member of the scavenger receptor cysteine-rich (SRCR) superfamily, and is exclusively expressed in monocytes and macrophages. It functions as an acute phase-regulated receptor involved in the clearance and endocytosis of hemoglobin/haptoglobin complexes by macrophages, and may thereby protect tissues from free hemoglobin-mediated oxidative damage. This protein may also function as an innate immune sensor for bacteria and inducer of local inflammation. Alternatively spliced transcript variants encoding different isoforms have been described for this gene. [provided by RefSeq, Aug 2011]","Scavenging of heme from plasma","CD molecules|Scavenger receptors|Scavenger receptor cysteine rich domain containing"
"28",0,0.729988750027829,0.885,0.469,0,"0","LY96","lymphocyte antigen 96","0, 12, 2","","This gene encodes a protein which associates with toll-like receptor 4 on the cell surface and confers responsiveness to lipopolysaccyaride (LPS), thus providing a link between the receptor and LPS signaling. Studies of the mouse ortholog suggest that this gene may be involved in endotoxin neutralization. Alternative splicing results in multiple transcript variants encoding different isoforms. [provided by RefSeq, Sep 2010]","ER-Phagosome pathway; via Death Receptors in the presence of ligand; Toll Like Receptor 4 (TLR4) Cascade; MyD88:Mal cascade initiated on plasma membrane; MyD88-independent TLR4 cascade ; TRIF-mediated programmed cell death; MyD88 deficiency (TLR2/4); IRAK4 deficiency (TLR2/4); Regulation of TLR by endogenous ligand; TICAM1,TRAF6-dependent induction of TAK1 complex; Activation of IRF3/IRF7 mediated by TBK1/IKK epsilon; IKK complex recruitment mediated by RIP1; TRAF6-mediated induction of TAK1 complex within TLR4 complex; IRAK2 mediated activation of TAK1 complex upon TLR7/8 or 9 stimulation",""
"29",0,0.728801673149791,0.966,0.665,0,"0","CTSC","cathepsin C","","neutrophil granulocyte","This gene encodes a member of the peptidase C1 family and lysosomal cysteine proteinase that appears to be a central coordinator for activation of many serine proteinases in cells of the immune system. Alternative splicing results in multiple transcript variants, at least one of which encodes a preproprotein that is proteolytically processed to generate heavy and light chains that form a disulfide-linked dimer. A portion of the propeptide acts as an intramolecular chaperone for the folding and stabilization of the mature enzyme. This enzyme requires chloride ions for activity and can degrade glucagon. Defects in the encoded protein have been shown to be a cause of Papillon-Lefevre syndrome, an autosomal recessive disorder characterized by palmoplantar keratosis and periodontitis. [provided by RefSeq, Nov 2015]","COPII-mediated vesicle transport; MHC class II antigen presentation; Cargo concentration in the ER; Neutrophil degranulation","Cathepsins"
