"","p_val","avg_logFC","pct.1","pct.2","p_val_adj","cluster","gene","GeneName","AlsoPresentInClusters","CellTypeFlag","Summary","Reactom","GeneFamily"
"284",2.30150931556032e-105,1.6700419451026,0.855,0.512,5.31096289658699e-101,"13","RAP1B","RAP1B, member of RAS oncogene family","","megakaryocyte, neutrophil granulocyte","This gene encodes a member of the RAS-like small GTP-binding protein superfamily. Members of this family regulate multiple cellular processes including cell adhesion and growth and differentiation. This protein localizes to cellular membranes and has been shown to regulate integrin-mediated cell signaling. This protein also plays a role in regulating outside-in signaling in platelets. Alternate splicing results in multiple transcript variants. Pseudogenes of this gene are found on chromosomes 3, 5, 6 and 9. [provided by RefSeq, Oct 2011]","Integrin alphaIIb beta3 signaling; GRB2:SOS provides linkage to MAPK signaling for Integrins ; p130Cas linkage to MAPK signaling for integrins; Rap1 signalling; MAP2K and MAPK activation; Neutrophil degranulation; Signaling by moderate kinase activity BRAF mutants; Signaling by high-kinase activity BRAF mutants; Signaling by RAS mutants; Signaling by BRAF and RAF fusions; Paradoxical activation of RAF signaling by kinase inactive BRAF; MET activates RAP1 and RAC1; Gene and protein expression by JAK-STAT signaling after Interleukin-12 stimulation","RAS type GTPase family"
"285",6.68872958524096e-103,1.10745988010169,0.657,0.27,1.5434912390902e-98,"13","CCND3","cyclin D3","","adipocytes","The protein encoded by this gene belongs to the highly conserved cyclin family, whose members are characterized by a dramatic periodicity in protein abundance through the cell cycle. Cyclins function as regulators of CDK kinases. Different cyclins exhibit distinct expression and degradation patterns which contribute to the temporal coordination of each mitotic event. This cyclin forms a complex with and functions as a regulatory subunit of CDK4 or CDK6, whose activtiy is required for cell cycle G1/S transition. This protein has been shown to interact with and be involved in the phosphorylation of tumor suppressor protein Rb. The CDK4 activity associated with this cyclin was reported to be necessary for cell cycle progression through G2 phase into mitosis after UV radiation. Several transcript variants encoding different isoforms have been found for this gene. [provided by RefSeq, Oct 2008]","Transcriptional regulation of white adipocyte differentiation; MAPK6/MAPK4 signaling; Cyclin D associated events in G1; Regulation of RUNX1 Expression and Activity","Cyclins"
"286",3.06465046795817e-100,1.68248532818882,0.445,0.129,7.07198741986028e-96,"13","NRGN","neurogranin","","","Neurogranin (NRGN) is the human homolog of the neuron-specific rat RC3/neurogranin gene. This gene encodes a postsynaptic protein kinase substrate that binds calmodulin in the absence of calcium. The NRGN gene contains four exons and three introns. The exons 1 and 2 encode the protein and exons 3 and 4 contain untranslated sequences. It is suggested that the NRGN is a direct target for thyroid hormone in human brain, and that control of expression of this gene could underlay many of the consequences of hypothyroidism on mental states during development as well as in adult subjects. [provided by RefSeq, Jul 2008]","",""
"287",3.07016580914398e-100,4.02847726003715,0.595,0.225,7.08471462118065e-96,"13","PF4","platelet factor 4","","megakaryocyte","This gene encodes a member of the CXC chemokine family. This chemokine is released from the alpha granules of activated platelets in the form of a homotetramer which has high affinity for heparin and is involved in platelet aggregation. This protein is chemotactic for numerous other cell type and also functions as an inhibitor of hematopoiesis, angiogenesis and T-cell function. The protein also exhibits antimicrobial activity against Plasmodium falciparum. [provided by RefSeq, Oct 2014]","Platelet degranulation ; Common Pathway of Fibrin Clot Formation; Cell surface interactions at the vascular wall; Chemokine receptors bind chemokines; G alpha (i) signalling events; RUNX1 regulates genes involved in megakaryocyte differentiation and platelet function",""
"288",2.39367913590504e-94,1.49480726253798,0.702,0.277,5.52365397401447e-90,"13","CXCL3","C-X-C motif chemokine ligand 3","13, 15","neutrophil granulocyte","This antimicrobial gene encodes a member of the CXC subfamily of chemokines. The encoded protein is a secreted growth factor that signals through the G-protein coupled receptor, CXC receptor 2. This protein plays a role in inflammation and as a chemoattractant for neutrophils. [provided by RefSeq, Sep 2014]","Chemokine receptors bind chemokines; G alpha (i) signalling events","Chemokine ligands|Endogenous ligands"
"289",3.72505750846633e-91,1.11674394848994,0.916,0.726,8.59594270653691e-87,"13","NAA38","N(alpha)-acetyltransferase 38, NatC auxiliary subunit","","","Not available","Retrograde transport at the Trans-Golgi-Network","N(alpha)-acetyltransferase subunits|LSm proteins"
"290",4.9113473743074e-85,1.57724675888054,0.368,0.098,1.13334252009518e-80,"13","TUBA4A","tubulin alpha 4a","13, 14","megakaryocyte","Microtubules of the eukaryotic cytoskeleton perform essential and diverse functions and are composed of a heterodimer of alpha and beta tubulin. The genes encoding these microtubule constituents are part of the tubulin superfamily, which is composed of six distinct families. Genes from the alpha, beta and gamma tubulin families are found in all eukaryotes. The alpha and beta tubulins represent the major components of microtubules, while gamma tubulin plays a critical role in the nucleation of microtubule assembly. There are multiple alpha and beta tubulin genes and they are highly conserved among and between species. This gene encodes an alpha tubulin that is a highly conserved homolog of a rat testis-specific alpha tubulin. Alternatively spliced transcript variants encoding different isoforms have been found for this gene. [provided by RefSeq, Jun 2013]","Platelet degranulation ; Translocation of SLC2A4 (GLUT4) to the plasma membrane; Microtubule-dependent trafficking of connexons from Golgi to the plasma membrane; Gap junction assembly; MHC class II antigen presentation; Separation of Sister Chromatids; Resolution of Sister Chromatid Cohesion; Regulation of PLK1 Activity at G2/M Transition; HSP90 chaperone cycle for steroid hormone receptors (SHR); Loss of Nlp from mitotic centrosomes; Recruitment of mitotic centrosome proteins and complexes; Loss of proteins required for interphase microtubule organization from the centrosome; Recruitment of NuMA to mitotic centrosomes; Prefoldin mediated transfer of substrate  to CCT/TriC; Formation of tubulin folding intermediates by CCT/TriC; Post-chaperonin tubulin folding pathway; Recycling pathway of L1; Recycling pathway of L1; Hedgehog 'off' state; Cilium Assembly; Anchoring of the basal body to the plasma membrane; Intraflagellar transport; RHO GTPases activate IQGAPs; RHO GTPases Activate Formins; COPI-mediated anterograde transport; COPI-dependent Golgi-to-ER retrograde traffic; COPI-independent Golgi-to-ER retrograde traffic; Mitotic Prometaphase; The role of GTSE1 in G2/M progression after G2 checkpoint; AURKA Activation by TPX2; Carboxyterminal post-translational modifications of tubulin; Carboxyterminal post-translational modifications of tubulin; Kinesins","Tubulins"
"291",5.80646309297569e-85,3.94706234514023,0.559,0.216,1.33989942333507e-80,"13","PPBP","pro-platelet basic protein","","megakaryocyte, neutrophil granulocyte","The protein encoded by this gene is a platelet-derived growth factor that belongs to the CXC chemokine family. This growth factor is a potent chemoattractant and activator of neutrophils. It has been shown to stimulate various cellular processes including DNA synthesis, mitosis, glycolysis, intracellular cAMP accumulation, prostaglandin E2 secretion, and synthesis of hyaluronic acid and sulfated glycosaminoglycan. It also stimulates the formation and secretion of plasminogen activator by synovial cells. The protein also is an antimicrobial protein with bactericidal and antifungal activity. [provided by RefSeq, Nov 2014]","Platelet degranulation ; Chemokine receptors bind chemokines; G alpha (i) signalling events; Neutrophil degranulation","Endogenous ligands"
"292",9.24855704828211e-78,1.67095330723221,0.293,0.067,2.13419702446158e-73,"13","ACRBP","acrosin binding protein","","gastric gland zymogenic cell, progenitor","The protein encoded by this gene is similar to proacrosin binding protein sp32 precursor found in mouse, guinea pig, and pig. This protein is located in the sperm acrosome and is thought to function as a binding protein to proacrosin for packaging and condensation of the acrosin zymogen in the acrosomal matrix. This protein is a member of the cancer/testis family of antigens and it is found to be immunogenic. In normal tissues, this mRNA is expressed only in testis, whereas it is detected in a range of different tumor types such as bladder, breast, lung, liver, and colon. [provided by RefSeq, Jul 2008]","","Armadillo-like helical domain containing"
"293",2.63874625192112e-70,1.24717414274068,0.75,0.428,6.08917085093318e-66,"13","LIMS1","LIM zinc finger domain containing 1","","","The protein encoded by this gene is an adaptor protein which contains five LIM domains, or double zinc fingers. The protein is likely involved in integrin signaling through its LIM domain-mediated interaction with integrin-linked kinase, found in focal adhesion plaques. It is also thought to act as a bridge linking integrin-linked kinase to NCK adaptor protein 2, which is involved in growth factor receptor kinase signaling pathways. Its localization to the periphery of spreading cells also suggests that this protein may play a role in integrin-mediated cell adhesion or spreading. Several transcript variants encoding different isoforms have been found for this gene. [provided by RefSeq, Jul 2010]","Cell-extracellular matrix interactions; Regulation of cytoskeletal remodeling and cell spreading by IPP complex components","LIM zinc finger domain containing|LIM domain containing"
"294",4.27580965215767e-68,1.32986385093022,0.75,0.474,9.86685835331905e-64,"13","PLEK","pleckstrin","","megakaryocyte","Not available","Platelet degranulation ","Pleckstrin homology domain containing"
"295",9.86151433674009e-43,1.33188342153465,0.305,0.109,2.27564304834614e-38,"13","C19orf33","chromosome 19 open reading frame 33","13, 18","fibroblasts","The protein encoded by this gene has been shown to be upregulated in SV40-immortalized fibroblasts as well as in endometrial carcinoma cells. The encoded protein is found primarily in the nucleus. This protein may play a role in placental development and diseases such as pre-eclampsia. Two transcript variants encoding different isoforms have been found for this gene. [provided by RefSeq, Dec 2015]","",""
"296",1.9744043896593e-41,0.988335658498648,0.755,0.466,4.55613556957781e-37,"13","TSC22D1","TSC22 domain family member 1","","","This gene encodes a member of the TSC22 domain family of leucine zipper transcription factors. The encoded protein is stimulated by transforming growth factor beta, and regulates the transcription of multiple genes including C-type natriuretic peptide. The encoded protein may play a critical role in tumor suppression through the induction of cancer cell apoptosis, and a single nucleotide polymorphism in the promoter of this gene has been associated with diabetic nephropathy. Alternatively spliced transcript variants encoding multiple isoforms have been observed for this gene. [provided by RefSeq, Aug 2011]","POU5F1 (OCT4), SOX2, NANOG repress genes related to differentiation",""
"297",1.70813776960527e-31,1.39125886000426,0.323,0.141,3.94169871714111e-27,"13","CCL5","C-C motif chemokine ligand 5","13, 19","basophil granulocyte, eosinophil granulocyte, monocyte","This gene is one of several chemokine genes clustered on the q-arm of chromosome 17. Chemokines form a superfamily of secreted proteins involved in immunoregulatory and inflammatory processes. The superfamily is divided into four subfamilies based on the arrangement of the N-terminal cysteine residues of the mature peptide. This chemokine, a member of the CC subfamily, functions as a chemoattractant for blood monocytes, memory T helper cells and eosinophils. It causes the release of histamine from basophils and activates eosinophils. This cytokine is one of the major HIV-suppressive factors produced by CD8+ cells. It functions as one of the natural ligands for the chemokine receptor chemokine (C-C motif) receptor 5 (CCR5), and it suppresses in vitro replication of the R5 strains of HIV-1, which use CCR5 as a coreceptor. Alternative splicing results in multiple transcript variants that encode different isoforms. [provided by RefSeq, Jul 2013]","Chemokine receptors bind chemokines; G alpha (i) signalling events; Interleukin-10 signaling","Chemokine ligands|Endogenous ligands"
"298",2.43890333307383e-31,1.43792020619977,0.545,0.328,5.62801333140117e-27,"13","GNG11","G protein subunit gamma 11","11, 13","","This gene is a member of the guanine nucleotide-binding protein (G protein) gamma family and encodes a lipid-anchored, cell membrane protein. As a member of the heterotrimeric G protein complex, this protein plays a role in this transmembrane signaling system. This protein is also subject to carboxyl-terminal processing. Decreased expression of this gene is associated with splenic marginal zone lymphomas. [provided by RefSeq, Jul 2008]","Glucagon signaling in metabolic regulation; G-protein activation; Glucagon-like Peptide-1 (GLP1) regulates insulin secretion; Glucagon-like Peptide-1 (GLP1) regulates insulin secretion; ADP signalling through P2Y purinoceptor 12; G beta:gamma signalling through PI3Kgamma; Prostacyclin signalling through prostacyclin receptor; Prostacyclin signalling through prostacyclin receptor; Adrenaline,noradrenaline inhibits insulin secretion; Adrenaline,noradrenaline inhibits insulin secretion; Ca2+ pathway; Ca2+ pathway; G alpha (q) signalling events; G alpha (12/13) signalling events; G beta:gamma signalling through PLC beta; G alpha (s) signalling events; ADP signalling through P2Y purinoceptor 1; ADP signalling through P2Y purinoceptor 1; G alpha (i) signalling events; G alpha (z) signalling events; Glucagon-type ligand receptors; Thromboxane signalling through TP receptor; Vasopressin regulates renal water homeostasis via Aquaporins; Thrombin signalling through proteinase activated receptors (PARs); Thrombin signalling through proteinase activated receptors (PARs); Presynaptic function of Kainate receptors; Cooperation of PDCL (PhLP1) and TRiC/CCT in G-protein beta folding","G protein subunits gamma"
"299",7.28384643805887e-27,1.15330694852819,0.466,0.269,1.68082040404646e-22,"13","CD9","CD9 molecule","","megakaryocyte, oocyte","This gene encodes a member of the transmembrane 4 superfamily, also known as the tetraspanin family. Tetraspanins are cell surface glycoproteins with four transmembrane domains that form multimeric complexes with other cell surface proteins. The encoded protein functions in many cellular processes including differentiation, adhesion, and signal transduction, and expression of this gene plays a critical role in the suppression of cancer cell motility and metastasis. [provided by RefSeq, Jan 2011]","Platelet degranulation ; Sperm:Oocyte Membrane Binding; Uptake and function of diphtheria toxin","CD molecules|Tetraspanins"
"300",1.17321375749083e-24,1.02865248228021,0.545,0.353,2.70730806678584e-20,"13","LMO4","LIM domain only 4","","","This gene encodes a cysteine-rich protein that contains two LIM domains but lacks a DNA-binding homeodomain. The encoded protein may play a role as a transcriptional regulator or as an oncogene. [provided by RefSeq, Aug 2008]","","LIM domain containing"
"301",0,0.882084971501657,0.453,0.022,0,"14","YPEL4","yippee like 4","","","Not available","","Yippee like family"
"302",1.17377784221582e-306,1.28285716873581,0.898,0.175,2.70860974869723e-302,"14","DONSON","downstream neighbor of SON","14, 17, 21, 5","","This gene lies downstream of the SON gene and spans 10 kb on chromosome 21. The function of this gene is unknown. [provided by RefSeq, Jul 2008]","",""
"303",6.96820420906956e-254,1.36441147694792,0.61,0.093,1.60798280328489e-249,"14","TUBA4A","tubulin alpha 4a","13, 14","megakaryocyte","Microtubules of the eukaryotic cytoskeleton perform essential and diverse functions and are composed of a heterodimer of alpha and beta tubulin. The genes encoding these microtubule constituents are part of the tubulin superfamily, which is composed of six distinct families. Genes from the alpha, beta and gamma tubulin families are found in all eukaryotes. The alpha and beta tubulins represent the major components of microtubules, while gamma tubulin plays a critical role in the nucleation of microtubule assembly. There are multiple alpha and beta tubulin genes and they are highly conserved among and between species. This gene encodes an alpha tubulin that is a highly conserved homolog of a rat testis-specific alpha tubulin. Alternatively spliced transcript variants encoding different isoforms have been found for this gene. [provided by RefSeq, Jun 2013]","Platelet degranulation ; Translocation of SLC2A4 (GLUT4) to the plasma membrane; Microtubule-dependent trafficking of connexons from Golgi to the plasma membrane; Gap junction assembly; MHC class II antigen presentation; Separation of Sister Chromatids; Resolution of Sister Chromatid Cohesion; Regulation of PLK1 Activity at G2/M Transition; HSP90 chaperone cycle for steroid hormone receptors (SHR); Loss of Nlp from mitotic centrosomes; Recruitment of mitotic centrosome proteins and complexes; Loss of proteins required for interphase microtubule organization from the centrosome; Recruitment of NuMA to mitotic centrosomes; Prefoldin mediated transfer of substrate  to CCT/TriC; Formation of tubulin folding intermediates by CCT/TriC; Post-chaperonin tubulin folding pathway; Recycling pathway of L1; Recycling pathway of L1; Hedgehog 'off' state; Cilium Assembly; Anchoring of the basal body to the plasma membrane; Intraflagellar transport; RHO GTPases activate IQGAPs; RHO GTPases Activate Formins; COPI-mediated anterograde transport; COPI-dependent Golgi-to-ER retrograde traffic; COPI-independent Golgi-to-ER retrograde traffic; Mitotic Prometaphase; The role of GTSE1 in G2/M progression after G2 checkpoint; AURKA Activation by TPX2; Carboxyterminal post-translational modifications of tubulin; Carboxyterminal post-translational modifications of tubulin; Kinesins","Tubulins"
"304",6.82449010990414e-176,2.22343902432931,0.772,0.249,1.57481933776148e-171,"14","GADD45A","growth arrest and DNA damage inducible alpha","","","This gene is a member of a group of genes whose transcript levels are increased following stressful growth arrest conditions and treatment with DNA-damaging agents. The protein encoded by this gene responds to environmental stresses by mediating activation of the p38/JNK pathway via MTK1/MEKK4 kinase. The DNA damage-induced transcription of this gene is mediated by both p53-dependent and -independent mechanisms. Alternatively spliced transcript variants encoding distinct isoforms have been found for this gene.[provided by RefSeq, Dec 2010]","TP53 Regulates Transcription of Genes Involved in G2 Cell Cycle Arrest",""
"305",6.30850978607833e-174,1.28217699840519,0.725,0.203,1.45575171823543e-169,"14","HBQ1","hemoglobin subunit theta 1","14, 17, 21, 22, 3, 5","erythrocyte","Theta-globin mRNA is found in human fetal erythroid tissue but not in adult erythroid or other nonerythroid tissue. The theta-1 gene may be expressed very early in embryonic life, perhaps sometime before 5 weeks. Theta-1 is a member of the human alpha-globin gene cluster that involves five functional genes and two pseudogenes. The order of genes is: 5' - zeta - pseudozeta - mu - pseudoalpha-2 -pseudoalpha-1 - alpha-2 - alpha-1 - theta-1 - 3'. Research supports a transcriptionally active role for the gene and a functional role for the peptide in specific cells, possibly those of early erythroid tissue. [provided by RefSeq, Jul 2008]","","Hemoglobin subunits"
"306",1.73029606023737e-171,1.00129360656507,0.56,0.114,3.99283118860374e-167,"14","KLF1","Kruppel like factor 1","14, 17, 22, 3","erythrocyte","This gene encodes a hematopoietic-specific transcription factor that induces high-level expression of adult beta-globin and other erythroid genes. The zinc-finger protein binds to the DNA sequence CCACACCCT found in the beta hemoglobin promoter. Heterozygous loss-of-function mutations in this gene result in the dominant In(Lu) blood phenotype. [provided by RefSeq, Oct 2009]","","Zinc fingers C2H2-type|Kruppel like factors"
"307",7.39511718897196e-163,1.23684808912586,0.56,0.124,1.70649724252717e-158,"14","SNHG10","small nucleolar RNA host gene 10","","","This gene is small nucleolar RNA host gene 10 and represents a non-protein coding RNA. Alternatively spliced transcript variants have been found for this gene. [provided by RefSeq, Jan 2013]","",""
"308",1.49754350484884e-148,1.56170354781119,1,0.837,3.45573139178919e-144,"14","HBA1","hemoglobin subunit alpha 1","14, 17, 21, 22, 3, 5","erythrocyte","The human alpha globin gene cluster located on chromosome 16 spans about 30 kb and includes seven loci: 5'- zeta - pseudozeta - mu - pseudoalpha-1 - alpha-2 - alpha-1 - theta - 3'. The alpha-2 (HBA2) and alpha-1 (HBA1) coding sequences are identical. These genes differ slightly over the 5' untranslated regions and the introns, but they differ significantly over the 3' untranslated regions. Two alpha chains plus two beta chains constitute HbA, which in normal adult life comprises about 97% of the total hemoglobin; alpha chains combine with delta chains to constitute HbA-2, which with HbF (fetal hemoglobin) makes up the remaining 3% of adult hemoglobin. Alpha thalassemias result from deletions of each of the alpha genes as well as deletions of both HBA2 and HBA1; some nondeletion alpha thalassemias have also been reported. [provided by RefSeq, Jul 2008]","Erythrocytes take up carbon dioxide and release oxygen; Erythrocytes take up oxygen and release carbon dioxide; Scavenging of heme from plasma","Hemoglobin subunits"
"309",2.66820408428224e-147,1.40890776595099,1,0.862,6.1571477448897e-143,"14","HBA2","hemoglobin subunit alpha 2","14, 17, 21, 22, 3, 5","erythrocyte","The human alpha globin gene cluster located on chromosome 16 spans about 30 kb and includes seven loci: 5'- zeta - pseudozeta - mu - pseudoalpha-1 - alpha-2 - alpha-1 - theta - 3'. The alpha-2 (HBA2) and alpha-1 (HBA1) coding sequences are identical. These genes differ slightly over the 5' untranslated regions and the introns, but they differ significantly over the 3' untranslated regions. Two alpha chains plus two beta chains constitute HbA, which in normal adult life comprises about 97% of the total hemoglobin; alpha chains combine with delta chains to constitute HbA-2, which with HbF (fetal hemoglobin) makes up the remaining 3% of adult hemoglobin. Alpha thalassemias result from deletions of each of the alpha genes as well as deletions of both HBA2 and HBA1; some nondeletion alpha thalassemias have also been reported. [provided by RefSeq, Jul 2008]","Erythrocytes take up carbon dioxide and release oxygen; Erythrocytes take up oxygen and release carbon dioxide; Scavenging of heme from plasma","Hemoglobin subunits"
"310",4.24324419246187e-147,2.05727594018667,0.997,0.889,9.79171029852502e-143,"14","HBE1","hemoglobin subunit epsilon 1","14, 22, 3","megakaryocyte","The epsilon globin gene (HBE) is normally expressed in the embryonic yolk sac: two epsilon chains together with two zeta chains (an alpha-like globin) constitute the embryonic hemoglobin Hb Gower I; two epsilon chains together with two alpha chains form the embryonic Hb Gower II. Both of these embryonic hemoglobins are normally supplanted by fetal, and later, adult hemoglobin. The five beta-like globin genes are found within a 45 kb cluster on chromosome 11 in the following order:  5'-epsilon - G-gamma - A-gamma - delta - beta-3' [provided by RefSeq, Jul 2008]","Factors involved in megakaryocyte development and platelet production","Hemoglobin subunits"
"311",1.37142339287146e-137,1.35031542628003,0.72,0.244,3.16469662139018e-133,"14","BPGM","bisphosphoglycerate mutase","14, 17, 21, 5","erythrocyte","2,3-diphosphoglycerate (2,3-DPG) is a small molecule found at high concentrations in red blood cells where it binds to and decreases the oxygen affinity of hemoglobin. This gene encodes a multifunctional enzyme that catalyzes 2,3-DPG synthesis via its synthetase activity, and 2,3-DPG degradation via its phosphatase activity. The enzyme also has phosphoglycerate phosphomutase activity. Deficiency of this enzyme increases the affinity of cells for oxygen. Mutations in this gene result in hemolytic anemia. Multiple alternatively spliced variants, encoding the same protein, have been identified. [provided by RefSeq, Sep 2009]","Glycolysis","Phosphoglycerate mutases|Bisphosphoglycerate phosphatases"
"312",1.76653732228502e-137,1.28949998606535,0.459,0.092,4.0764615249049e-133,"14","CMB9-22P13.1","CMB9-22P13.1","","","CMB9-22P13.1","CMB9-22P13.1","CMB9-22P13.1"
"313",4.01263863181537e-131,1.25020136223099,0.497,0.114,9.25956490677715e-127,"14","RP11-51J9.5","RP11-51J9.5","","","RP11-51J9.5","RP11-51J9.5","RP11-51J9.5"
