"","p_val","avg_logFC","pct.1","pct.2","p_val_adj","cluster","gene","GeneName","AlsoPresentInClusters","CellTypeFlag","Summary","Reactom","GeneFamily"
"887",0,1.25368962287101,0.961,0.16,0,"4","POSTN","periostin","16, 4","","This gene encodes a secreted extracellular matrix protein that functions in tissue development and regeneration, including wound healing, and ventricular remodeling following myocardial infarction. The encoded protein binds to integrins to support adhesion and migration of epithelial cells. This protein plays a role in cancer stem cell maintenance and metastasis. Mice lacking this gene exhibit cardiac valve disease, and skeletal and dental defects. Alternative splicing results in multiple transcript variants encoding different isoforms. [provided by RefSeq, Sep 2015]","","Gla domain containing"
"888",0,1.22273894306757,0.856,0.143,0,"4","COL4A1","collagen type IV alpha 1 chain","4, 6","","This gene encodes a type IV collagen alpha protein. Type IV collagen proteins are integral components of basement membranes. This gene shares a bidirectional promoter with a paralogous gene on the opposite strand. The protein consists of an amino-terminal 7S domain, a triple-helix forming collagenous domain, and a carboxy-terminal non-collagenous domain. It functions as part of a heterotrimer and interacts with other extracellular matrix components such as perlecans, proteoglycans, and laminins. In addition, proteolytic cleavage of the non-collagenous carboxy-terminal domain results in a biologically active fragment known as arresten, which has anti-angiogenic and tumor suppressor properties. Mutations in this gene cause porencephaly, cerebrovascular disease, and renal and muscular defects. Alternative splicing results in multiple transcript variants. [provided by RefSeq, Dec 2014]","Collagen degradation; Collagen degradation; Extracellular matrix organization; Collagen biosynthesis and modifying enzymes; Signaling by PDGF; Assembly of collagen fibrils and other multimeric structures; Integrin cell surface interactions; Integrin cell surface interactions; Anchoring fibril formation; Crosslinking of collagen fibrils; Laminin interactions; Laminin interactions; Non-integrin membrane-ECM interactions; ECM proteoglycans; Scavenging by Class A Receptors; NCAM1 interactions; Collagen chain trimerization","Collagens"
"889",0,1.21820128513507,0.988,0.447,0,"4","MAGED2","MAGE family member D2","","megakaryocyte","This gene is a member of the MAGED gene family. The MAGED genes are clustered on chromosome Xp11. This gene is located in Xp11.2, a hot spot for X-linked intellectual disability (XLID). Mutations in this gene cause a form of transient antenatal Bartter's syndrome. This gene may also be involved in several types of cancer, including breast cancer and melanoma. The protein encoded by this gene is progressively recruited from the cytoplasm to the nucleoplasm during the interphase and after nucleolar stress and is thus thought to play a role in cell cycle regulation. Alternative splicing results in multiple transcript variants. [provided by RefSeq, Jul 2017]","Platelet degranulation ","MAGE family"
"890",0,1.21014111290181,0.625,0.088,0,"4","COLEC11","collectin subfamily member 11","4, 6","","This gene encodes a member of the collectin family of C-type lectins that possess collagen-like sequences and carbohydrate recognition domains. Collectins are secreted proteins that play important roles in the innate immune system by binding to carbohydrate antigens on microorganisms, facilitating their recognition and removal. The encoded protein binds to multiple sugars with a preference for fucose and mannose. Mutations in this gene are a cause of 3MC syndrome-2. Alternatively spliced transcript variants encoding multiple isoforms have been observed for this gene. [provided by RefSeq, Dec 2011]","Lectin pathway of complement activation; Initial triggering of complement; Scavenging by Class A Receptors","Collectins|C-type lectin domain containing|Complement system activation components"
"891",0,1.19884738464501,0.945,0.262,0,"4","PPIC","peptidylprolyl isomerase C","","","The protein encoded by this gene is a member of the peptidyl-prolyl cis-trans isomerase (PPIase)) family. PPIases catalyze the cis-trans isomerization of proline imidic peptide bonds in oligopeptides and accelerate the folding of proteins. Similar to other PPIases, this protein can bind immunosuppressant cyclosporin A. [provided by RefSeq, Jul 2008]","","Cyclophilin peptidylprolyl isomerases"
"892",0,1.19720134463792,0.875,0.151,0,"4","SPON2","spondin 2","4, 6","","Not available","Defective B3GALTL causes Peters-plus syndrome (PpS); O-glycosylation of TSR domain-containing proteins",""
"893",0,1.19208982665729,0.754,0.127,0,"4","IGFBP3","insulin like growth factor binding protein 3","4, 6","","This gene is a member of the insulin-like growth factor binding protein (IGFBP) family and encodes a protein with an IGFBP domain and a thyroglobulin type-I domain. The protein forms a ternary complex with insulin-like growth factor acid-labile subunit (IGFALS) and either insulin-like growth factor (IGF) I or II. In this form, it circulates in the plasma, prolonging the half-life of IGFs and altering their interaction with cell surface receptors. Alternate transcriptional splice variants, encoding different isoforms, have been characterized. [provided by RefSeq, Jul 2008]","Regulation of Insulin-like Growth Factor (IGF) transport and uptake by Insulin-like Growth Factor Binding Proteins (IGFBPs); TP53 Regulates Transcription of Death Receptors and Ligands; Post-translational protein phosphorylation","Insulin like growth factor binding proteins"
"894",0,1.19045519407008,0.982,0.46,0,"4","S100A10","S100 calcium binding protein A10","15, 16, 18, 4","","The protein encoded by this gene is a member of the S100 family of proteins containing 2 EF-hand calcium-binding motifs. S100 proteins are localized in the cytoplasm and/or nucleus of a wide range of cells, and involved in the regulation of a number of cellular processes such as cell cycle progression and differentiation. S100 genes include at least 13 members which are located as a cluster on chromosome 1q21. This protein may function in exocytosis and endocytosis. [provided by RefSeq, Jul 2008]","Dissolution of Fibrin Clot","S100 calcium binding proteins"
"895",0,1.18557763443662,0.903,0.111,0,"4","COL5A1","collagen type V alpha 1 chain","","","This gene encodes an alpha chain for one of the low abundance fibrillar collagens. Fibrillar collagen molecules are trimers that can be composed of one or more types of alpha chains. Type V collagen is found in tissues containing type I collagen and appears to regulate the assembly of heterotypic fibers composed of both type I and type V collagen. This gene product is closely related to type XI collagen and it is possible that the collagen chains of types V and XI constitute a single collagen type with tissue-specific chain combinations. The encoded procollagen protein occurs commonly as the heterotrimer pro-alpha1(V)-pro-alpha1(V)-pro-alpha2(V). Mutations in this gene are associated with Ehlers-Danlos syndrome, types I and II. Alternative splicing of this gene results in multiple transcript variants. [provided by RefSeq, May 2013]","Collagen degradation; Extracellular matrix organization; Collagen biosynthesis and modifying enzymes; Signaling by PDGF; Assembly of collagen fibrils and other multimeric structures; Integrin cell surface interactions; Syndecan interactions; Non-integrin membrane-ECM interactions; ECM proteoglycans; NCAM1 interactions; MET activates PTK2 signaling; Collagen chain trimerization","Collagens"
"896",0,1.1726578174923,0.915,0.221,0,"4","KCNQ1OT1","KCNQ1 opposite strand/antisense transcript 1","","","Human chromosomal region 11p15.5 contains two clusters of epigenetically-regulated genes that are expressed from only one chromosome in a parent-of-origin manner. Each cluster, or imprinted domain, is regulated by a functionally independent imprinting control region (ICR). The human CDKN1C/KCNQ1OT1 domain is regulated by an ICR located in an intron of KCNQ1, and contains at least eight genes that are expressed exclusively or preferentially from the maternally-inherited allele. The DNA of the ICR is specifically methylated on the maternally-inherited chromosome, and unmethylated on the paternally-inherited chromosome. The ICR contains the promoter of the KCNQ1OT1 gene that is exclusively expressed from the paternal allele. The KCNQ1OT1 transcript is the antisense to the KCNQ1 gene and is a unspliced long non-coding RNA. It interacts with chromatin and regulates transcription of multiple target genes through epigenetic modifications. The transcript is abnormally expressed from both chromosomes in most patients with Beckwith-Wiedemann syndrome, and the transcript also plays an important role in colorectal carcinogenesis. [provided by RefSeq, Apr 2012]","","Long non-coding RNAs (published)"
"897",0,1.17226084077847,0.977,0.241,0,"4","GPC3","glypican 3","18, 4, 8","","Cell surface heparan sulfate proteoglycans are composed of a membrane-associated protein core substituted with a variable number of heparan sulfate chains. Members of the glypican-related integral membrane proteoglycan family (GRIPS) contain a core protein anchored to the cytoplasmic membrane via a glycosyl phosphatidylinositol linkage. These proteins may play a role in the control of cell division and growth regulation. The protein encoded by this gene can bind to and inhibit the dipeptidyl peptidase activity of CD26, and it can induce apoptosis in certain cell types. Deletion mutations in this gene are associated with Simpson-Golabi-Behmel syndrome, also known as Simpson dysmorphia syndrome. Alternative splicing results in multiple transcript variants. [provided by RefSeq, Sep 2009]","A tetrasaccharide linker sequence is required for GAG synthesis; HS-GAG biosynthesis; HS-GAG biosynthesis; HS-GAG degradation; Defective B4GALT7 causes EDS, progeroid type; Defective B3GAT3 causes JDSSDHD; Defective EXT2 causes exostoses 2; Defective EXT1 causes exostoses 1, TRPS2 and CHDS; Regulation of Insulin-like Growth Factor (IGF) transport and uptake by Insulin-like Growth Factor Binding Proteins (IGFBPs); Defective B3GALT6 causes EDSP2 and SEMDJL1; Post-translational protein phosphorylation; Retinoid metabolism and transport","Glypicans"
"898",0,1.16214347320743,0.311,0.032,0,"4","ACTC1","actin, alpha, cardiac muscle 1","","","Actins are highly conserved proteins that are involved in various types of cell motility. Polymerization of globular actin (G-actin) leads to a structural filament (F-actin) in the form of a two-stranded helix. Each actin can bind to four others. The protein encoded by this gene belongs to the actin family which is comprised of three main groups of actin isoforms, alpha, beta, and gamma. The alpha actins are found in muscle tissues and are a major constituent of the contractile apparatus. Defects in this gene have been associated with idiopathic dilated cardiomyopathy (IDC) and familial hypertrophic cardiomyopathy (FHC). [provided by RefSeq, Jul 2008]","Striated Muscle Contraction","Actins"
"899",0,1.15828769835716,0.788,0.061,0,"4","NID2","nidogen 2","","","This gene encodes a member of the nidogen family of basement membrane proteins. This protein is a cell-adhesion protein that binds collagens I and IV and laminin and may be involved in maintaining the structure of the basement membrane.[provided by RefSeq, Jun 2010]","Laminin interactions; Laminin interactions",""
"900",2.99307629684928e-187,1.23365990349841,0.287,0.053,6.90682286260941e-183,"4","PLA2G2A","phospholipase A2 group IIA","","","The protein encoded by this gene is a member of the phospholipase A2 family (PLA2). PLA2s constitute a diverse family of enzymes with respect to sequence, function, localization, and divalent cation requirements. This gene product belongs to group II, which contains secreted form of PLA2, an extracellular enzyme that has a low molecular mass and requires calcium ions for catalysis. It catalyzes the hydrolysis of the sn-2 fatty acid acyl ester bond of phosphoglycerides, releasing free fatty acids and lysophospholipids, and thought to participate in the regulation of the phospholipid metabolism in biomembranes. Several alternatively spliced transcript variants with different 5' UTRs have been found for this gene.[provided by RefSeq, Sep 2009]","Acyl chain remodelling of PC; Acyl chain remodelling of PS; Acyl chain remodelling of PE; Acyl chain remodelling of PI; Acyl chain remodelling of PG; Synthesis of PA; Antimicrobial peptides","Phospholipases"
"901",0,3.58781079378724,1,0.1,0,"5","HBB","hemoglobin subunit beta","17, 21, 5","erythrocyte, megakaryocyte, neutrophil granulocyte","The alpha (HBA) and beta (HBB) loci determine the structure of the 2 types of polypeptide chains in adult hemoglobin, Hb A. The normal adult hemoglobin tetramer consists of two alpha chains and two beta chains. Mutant beta globin causes sickle cell anemia. Absence of beta chain causes beta-zero-thalassemia. Reduced amounts of detectable beta globin causes beta-plus-thalassemia. The order of the genes in the beta-globin cluster is 5'-epsilon -- gamma-G -- gamma-A -- delta -- beta--3'. [provided by RefSeq, Jul 2008]","Erythrocytes take up carbon dioxide and release oxygen; Erythrocytes take up oxygen and release carbon dioxide; Scavenging of heme from plasma; Neutrophil degranulation; Factors involved in megakaryocyte development and platelet production","Hemoglobin subunits"
"902",0,2.91173936329373,1,0.853,0,"5","HBG2","hemoglobin subunit gamma 2","14, 17, 21, 22, 3, 5","megakaryocyte","The gamma globin genes (HBG1 and HBG2) are normally expressed in the fetal liver, spleen and bone marrow. Two gamma chains together with two alpha chains constitute fetal hemoglobin (HbF) which is normally replaced by adult hemoglobin (HbA) at birth. In some beta-thalassemias and related conditions, gamma chain production continues into adulthood. The two types of gamma chains differ at residue 136 where glycine is found in the G-gamma product (HBG2) and alanine is found in the A-gamma product (HBG1). The former is predominant at birth. The order of the genes in the beta-globin cluster is: 5'- epsilon -- gamma-G -- gamma-A -- delta -- beta--3'. [provided by RefSeq, Jul 2008]","Factors involved in megakaryocyte development and platelet production","Hemoglobin subunits"
"903",0,2.83480222044474,1,0.857,0,"5","HBA2","hemoglobin subunit alpha 2","14, 17, 21, 22, 3, 5","erythrocyte","The human alpha globin gene cluster located on chromosome 16 spans about 30 kb and includes seven loci: 5'- zeta - pseudozeta - mu - pseudoalpha-1 - alpha-2 - alpha-1 - theta - 3'. The alpha-2 (HBA2) and alpha-1 (HBA1) coding sequences are identical. These genes differ slightly over the 5' untranslated regions and the introns, but they differ significantly over the 3' untranslated regions. Two alpha chains plus two beta chains constitute HbA, which in normal adult life comprises about 97% of the total hemoglobin; alpha chains combine with delta chains to constitute HbA-2, which with HbF (fetal hemoglobin) makes up the remaining 3% of adult hemoglobin. Alpha thalassemias result from deletions of each of the alpha genes as well as deletions of both HBA2 and HBA1; some nondeletion alpha thalassemias have also been reported. [provided by RefSeq, Jul 2008]","Erythrocytes take up carbon dioxide and release oxygen; Erythrocytes take up oxygen and release carbon dioxide; Scavenging of heme from plasma","Hemoglobin subunits"
"904",0,2.610917298564,1,0.831,0,"5","HBA1","hemoglobin subunit alpha 1","14, 17, 21, 22, 3, 5","erythrocyte","The human alpha globin gene cluster located on chromosome 16 spans about 30 kb and includes seven loci: 5'- zeta - pseudozeta - mu - pseudoalpha-1 - alpha-2 - alpha-1 - theta - 3'. The alpha-2 (HBA2) and alpha-1 (HBA1) coding sequences are identical. These genes differ slightly over the 5' untranslated regions and the introns, but they differ significantly over the 3' untranslated regions. Two alpha chains plus two beta chains constitute HbA, which in normal adult life comprises about 97% of the total hemoglobin; alpha chains combine with delta chains to constitute HbA-2, which with HbF (fetal hemoglobin) makes up the remaining 3% of adult hemoglobin. Alpha thalassemias result from deletions of each of the alpha genes as well as deletions of both HBA2 and HBA1; some nondeletion alpha thalassemias have also been reported. [provided by RefSeq, Jul 2008]","Erythrocytes take up carbon dioxide and release oxygen; Erythrocytes take up oxygen and release carbon dioxide; Scavenging of heme from plasma","Hemoglobin subunits"
"905",0,2.00894788428948,1,0.552,0,"5","HBG1","hemoglobin subunit gamma 1","17, 21, 22, 3, 5","megakaryocyte","The gamma globin genes (HBG1 and HBG2) are normally expressed in the fetal liver, spleen and bone marrow. Two gamma chains together with two alpha chains constitute fetal hemoglobin (HbF) which is normally replaced by adult hemoglobin (HbA) at birth. In some beta-thalassemias and related conditions, gamma chain production continues into adulthood. The two types of gamma chains differ at residue 136 where glycine is found in the G-gamma product (HBG2) and alanine is found in the A-gamma product (HBG1). The former is predominant at birth. The order of the genes in the beta-globin cluster is: 5'-epsilon -- gamma-G -- gamma-A -- delta -- beta--3'. [provided by RefSeq, Jul 2008]","Factors involved in megakaryocyte development and platelet production","Hemoglobin subunits"
"906",0,1.96351403011484,0.999,0.383,0,"5","SNCA","synuclein alpha","17, 21, 5","","Alpha-synuclein is a member of the synuclein family, which also includes beta- and gamma-synuclein. Synucleins are abundantly expressed in the brain and alpha- and beta-synuclein inhibit phospholipase D2 selectively. SNCA may serve to integrate presynaptic signaling and membrane trafficking. Defects in SNCA have been implicated in the pathogenesis of Parkinson disease. SNCA peptides are a major component of amyloid plaques in the brains of patients with Alzheimer's disease. Alternatively spliced transcripts encoding different isoforms have been identified for this gene. [provided by RefSeq, Feb 2016]","Amyloid fiber formation","Parkinson disease associated genes"
"907",0,1.54731773621805,0.985,0.213,0,"5","BPGM","bisphosphoglycerate mutase","14, 17, 21, 5","erythrocyte","2,3-diphosphoglycerate (2,3-DPG) is a small molecule found at high concentrations in red blood cells where it binds to and decreases the oxygen affinity of hemoglobin. This gene encodes a multifunctional enzyme that catalyzes 2,3-DPG synthesis via its synthetase activity, and 2,3-DPG degradation via its phosphatase activity. The enzyme also has phosphoglycerate phosphomutase activity. Deficiency of this enzyme increases the affinity of cells for oxygen. Mutations in this gene result in hemolytic anemia. Multiple alternatively spliced variants, encoding the same protein, have been identified. [provided by RefSeq, Sep 2009]","Glycolysis","Phosphoglycerate mutases|Bisphosphoglycerate phosphatases"
"908",0,1.53312885362281,0.991,0.21,0,"5","ALAS2","5'-aminolevulinate synthase 2","17, 21, 22, 3, 5","erythrocyte","The product of this gene specifies an erythroid-specific mitochondrially located enzyme. The encoded protein catalyzes the first step in the heme biosynthetic pathway. Defects in this gene cause X-linked pyridoxine-responsive sideroblastic anemia. Alternatively spliced transcript variants encoding different isoforms have been identified. [provided by RefSeq, Jul 2008]","Heme biosynthesis",""
"909",0,1.48051729517553,1,0.56,0,"5","SLC25A37","solute carrier family 25 member 37","14, 17, 21, 22, 3, 5","","SLC25A37 is a solute carrier localized in the mitochondrial inner membrane. It functions as an essential iron importer for the synthesis of mitochondrial heme and iron-sulfur clusters (summary by Chen et al., 2009 [PubMed 19805291]).[supplied by OMIM, Jan 2011]","Mitochondrial iron-sulfur cluster biogenesis","Solute carriers"
"910",0,1.43776418771529,0.999,0.313,0,"5","AC104389.1","AC104389.1","14, 17, 21, 5","","AC104389.1","AC104389.1","AC104389.1"
"911",0,1.37894005042208,0.998,0.146,0,"5","DONSON","downstream neighbor of SON","14, 17, 21, 5","","This gene lies downstream of the SON gene and spans 10 kb on chromosome 21. The function of this gene is unknown. [provided by RefSeq, Jul 2008]","",""
"912",0,0.918971001097235,0.994,0.724,0,"5","FKBP8","FK506 binding protein 8","21, 5","","The protein encoded by this gene is a member of the immunophilin protein family, which play a role in immunoregulation and basic cellular processes involving protein folding and trafficking. Unlike the other members of the family, this encoded protein does not seem to have PPIase/rotamase activity. It may have a role in neurons associated with memory function. [provided by RefSeq, Jul 2008]","Ub-specific processing proteases","Tetratricopeptide repeat domain containing|FKBP prolyl isomerases"
"913",0,0.914797334521919,0.972,0.588,0,"5","NCOA4","nuclear receptor coactivator 4","17, 5","","This gene encodes an androgen receptor coactivator. The encoded protein interacts with the androgen receptor in a ligand-dependent manner to enhance its transcriptional activity. Chromosomal translocations between this gene and the ret tyrosine kinase gene, also located on chromosome 10, have been associated with papillary thyroid carcinoma. Alternatively spliced transcript variants have been described. Pseudogenes are present on chromosomes 4, 5, 10, and 14. [provided by RefSeq, Feb 2009]","",""
"914",0,0.886991670681976,0.865,0.164,0,"5","HEMGN","hemogen","14, 17, 22, 3, 5","","Not available","",""
"915",0,0.850104396201807,0.926,0.293,0,"5","HBM","hemoglobin subunit mu","17, 22, 3, 5","","The human alpha globin gene cluster located on chromosome 16 spans about 30 kb and includes seven loci: 5'- zeta - pseudozeta - mu - pseudoalpha-1 - alpha-2 - alpha-1 - theta - 3'. This gene has an ORF encoding a 141 aa polypeptide which is similar to the delta globins found in reptiles and birds. This locus was originally described as a pseudogene; however, it is currently thought to be a protein-coding gene. [provided by RefSeq, Jul 2008]","","Hemoglobin subunits"
"916",0,0.646012608374927,0.851,0.276,0,"5","STRADB","STE20-related kinase adaptor beta","17, 21, 3, 5","","This gene encodes a protein that belongs to the serine/threonine protein kinase STE20 subfamily. One of the active site residues in the protein kinase domain of this protein is altered, and it is thus a pseudokinase. This protein is a component of a complex involved in the activation of serine/threonine kinase 11, a master kinase that regulates cell polarity and energy-generating metabolism. This complex regulates the relocation of this kinase from the nucleus to the cytoplasm, and it is essential for G1 cell cycle arrest mediated by this kinase. The protein encoded by this gene can also interact with the X chromosome-linked inhibitor of apoptosis protein, and this interaction enhances the anti-apoptotic activity of this protein via the JNK1 signal transduction pathway. Two pseudogenes, located on chromosomes 1 and 7, have been found for this gene. Alternatively spliced transcript variants encoding different isoforms have been found for this gene. [provided by RefSeq, May 2011]","Energy dependent regulation of mTOR by LKB1-AMPK",""
"917",0,0.61720299590574,0.983,0.389,0,"5","AHSP","alpha hemoglobin stabilizing protein","17, 21, 22, 3, 5","","This gene encodes a molecular chaperone which binds specifically to free alpha-globin and is involved in hemoglobin assembly. The encoded protein binds to monomeric alpha-globin until it has been transferred to beta-globin to form a heterodimer, which in turn binds to another heterodimer to form the stable tetrameric hemoglobin. Alternative splicing results in multiple transcript variants. [provided by RefSeq, Dec 2015]","",""
"918",0,0.605031470874531,0.752,0.086,0,"5","ACVR2B","activin A receptor type 2B","21, 5","","Activins are dimeric growth and differentiation factors which belong to the transforming growth factor-beta (TGF-beta) superfamily of structurally related signaling proteins. Activins signal through a heteromeric complex of receptor serine kinases which include at least two type I (I and IB) and two type II (II and IIB) receptors. These receptors are all transmembrane proteins, composed of a ligand-binding extracellular domain with cysteine-rich region, a transmembrane domain, and a cytoplasmic domain with predicted serine/threonine specificity. Type I receptors are essential for signaling; and type II receptors are required for binding ligands and for expression of type I receptors. Type I and II receptors form a stable complex after ligand binding, resulting in phosphorylation of type I receptors by type II receptors. Type II receptors are considered to be constitutively active kinases. This gene encodes activin A type IIB receptor, which displays a 3- to 4-fold higher affinity for the ligand than activin A type II receptor. [provided by RefSeq, Jul 2008]","Signaling by NODAL; Regulation of signaling by NODAL; Signaling by Activin; Signaling by Activin; Signaling by BMP","Type 2 receptor serine/threonine kinases"
"919",0,0.582059554664744,0.651,0.028,0,"5","PHOSPHO1","phosphoethanolamine/phosphocholine phosphatase","17, 5","","Not available","Synthesis of PC; Synthesis of PE","HAD Asp-based non-protein phosphatases"
